<?xml version="1.0" encoding="UTF-8"?>
<!--
    (c) Copyright 2018 CERN for the benefit of the LHCb Collaboration

    This software is distributed under the terms of the GNU General Public
    Licence version 3 (GPL Version 3), copied verbatim in the file "COPYING".

    In applying this licence, CERN does not waive the privileges and immunities
    granted to it by virtue of its status as an Intergovernmental Organization
    or submit itself to any jurisdiction.
-->
<summary version="1.0" xmlns:xsi="http://www.w3.org/2001/XMLSchema-instance" xsi:noNamespaceSchemaLocation="XMLSummary.xsd">
  <success>false</success>
  <step>none</step>
  <usage/>
  <input/>
  <output/>
  <counters/>
  <lumiCounters/>
</summary>
